{
  "$schema": "https://json-schema.org/draft/2020-12/schema",
  "description": "TODO",
  "type": "object",

  "properties": {
    "device_name": {
      "type": "string",
      "description": "The name of the device the kernel tuner analysis is run on."
    },

    "kernel_name": {
      "type": "string",
      "description": "The name of the kernel."
    },

    "problem_size": {
      "type": "array",
      "description": "The size of the problem."
    },

    "tune_params_keys": {
      "type": "array",
      "description": "The keys (names) of all the parameters being tuned."
    },

    "tune_params": {
      "type": "object",
      "description": "The nested JSON object containing for each parameter the array of tuning values."
    },

    "objective": {
      "type": "string",
      "description": "The objective with kernel."
    },

    "cache": {
      "type": "object",
      "description": "The actual data; the data of the instances cached.",
      "patternProperties": {
        "/^\\d+(,\\d+)*$/": {
          "type": "object",
          "properties": {
            "time": {"type": "number"},
            "times": {"type": "array"},
            "compile_time": {"type": "number"},
            "verification_time": {"type": "integer"},
            "benchmark_time": {"type": "number"},
            "GFLOP/s": {"type": "number"},
            "strategy_time": {"type": "integer"},
            "framework_time": {"type": "number"},
            "timestamp": {"type": "string"}
          },
          "additionalProperties": true
        }
      }

    }
  }
}
